entity_id,condition_type,value_range,description
KG-CLI-001,高温,日均温度>30°C或最高温度>35°C,持续高温天气加速害虫发育和繁殖速度，高温伴随干旱时红蜘蛛类害虫暴发，高温高湿则促进多数真菌病害流行
KG-CLI-002,高湿,相对湿度>80%或连续降雨>3天,高湿度环境有利于真菌孢子萌发和侵染，是炭疽病锈病褐斑病等叶部和果实病害流行的关键气象因子
KG-CLI-003,干旱,连续无有效降雨>15天或土壤含水量<40%,干旱胁迫削弱树体抗病虫能力，有利于红蜘蛛和蚜虫等刺吸式害虫的发生，加重裂果病和日灼病发生
KG-CLI-004,多雨,月降雨量>150mm或降雨日数>15天,多雨天气创造高湿环境促进病菌传播和侵染，雨水飞溅传播土壤中的病原菌，连续降雨影响喷药防治效果
KG-CLI-005,温暖,日均温度20-28°C适宜多数病虫害发生,枣树生长发育的适宜温度范围也是大多数病虫害的适宜发生温度，温暖季节病虫害活动频繁危害加重
KG-CLI-006,低温,日均温度<5°C或最低温度<0°C,低温使枣树进入休眠期病虫害也进入越冬状态，冬季低温可冻死部分越冬害虫和病原菌，但极端低温可造成树体冻伤为病菌侵入创造条件
